{
  "commands": [
    "dv-platform analyze-rtl",
    "dv-platform plan --target formal",
    "dv-platform generate --target formal",
    "dv-platform run --target formal",
    "dv-platform coverage --from-runs",
    "dv-platform status --policy ci"
  ],
  "configuration_sha256": "b5ceb73fbfba16f3502571509050003d933a467a5207806dca1dc0706f0d638d",
  "coverage": {
    "measured_ids": [
      "broad_protocol_endpoints:check:092ebe8f4985",
      "broad_protocol_endpoints:check:1f329a88a151",
      "broad_protocol_endpoints:check:2e7e3860fd81",
      "broad_protocol_endpoints:check:41ad9a9866fd",
      "broad_protocol_endpoints:check:41dde9ef374e",
      "broad_protocol_endpoints:check:4275564e7b76",
      "broad_protocol_endpoints:check:48cf09af2d58",
      "broad_protocol_endpoints:check:4d16ecf90a94",
      "broad_protocol_endpoints:check:5690b441904b",
      "broad_protocol_endpoints:check:5bf609ff4b55",
      "broad_protocol_endpoints:check:5c2718024236",
      "broad_protocol_endpoints:check:7c29014cdfde",
      "broad_protocol_endpoints:check:89bbfbe9b43e",
      "broad_protocol_endpoints:check:92e5c8c4a819",
      "broad_protocol_endpoints:check:93b63328faea",
      "broad_protocol_endpoints:check:9ab7372f2622",
      "broad_protocol_endpoints:check:a6d89bdbb106",
      "broad_protocol_endpoints:check:b586e0702dff",
      "broad_protocol_endpoints:check:b5d14e09d9e2",
      "broad_protocol_endpoints:check:b8948de5ebf9",
      "broad_protocol_endpoints:check:c89d09bbd364",
      "broad_protocol_endpoints:check:db637a3de726",
      "broad_protocol_endpoints:check:e29b0e8f5028",
      "broad_protocol_endpoints:check:f63c10800a10",
      "broad_protocol_endpoints:check:fa031e94c5d0"
    ],
    "missing_ids": [],
    "schema_version": 3
  },
  "execution_kind": "real",
  "expected_checks": [
    "broad_protocol_endpoints:check:092ebe8f4985",
    "broad_protocol_endpoints:check:1f329a88a151",
    "broad_protocol_endpoints:check:2e7e3860fd81",
    "broad_protocol_endpoints:check:41ad9a9866fd",
    "broad_protocol_endpoints:check:41dde9ef374e",
    "broad_protocol_endpoints:check:4275564e7b76",
    "broad_protocol_endpoints:check:48cf09af2d58",
    "broad_protocol_endpoints:check:4d16ecf90a94",
    "broad_protocol_endpoints:check:5690b441904b",
    "broad_protocol_endpoints:check:5bf609ff4b55",
    "broad_protocol_endpoints:check:5c2718024236",
    "broad_protocol_endpoints:check:7c29014cdfde",
    "broad_protocol_endpoints:check:89bbfbe9b43e",
    "broad_protocol_endpoints:check:92e5c8c4a819",
    "broad_protocol_endpoints:check:93b63328faea",
    "broad_protocol_endpoints:check:9ab7372f2622",
    "broad_protocol_endpoints:check:a6d89bdbb106",
    "broad_protocol_endpoints:check:b586e0702dff",
    "broad_protocol_endpoints:check:b5d14e09d9e2",
    "broad_protocol_endpoints:check:b8948de5ebf9",
    "broad_protocol_endpoints:check:c89d09bbd364",
    "broad_protocol_endpoints:check:db637a3de726",
    "broad_protocol_endpoints:check:e29b0e8f5028",
    "broad_protocol_endpoints:check:f63c10800a10",
    "broad_protocol_endpoints:check:fa031e94c5d0"
  ],
  "mutant_outcomes": [
    {
      "check_ids": [
        "broad_protocol_endpoints:check:092ebe8f4985",
        "broad_protocol_endpoints:check:1f329a88a151",
        "broad_protocol_endpoints:check:2e7e3860fd81",
        "broad_protocol_endpoints:check:41ad9a9866fd",
        "broad_protocol_endpoints:check:41dde9ef374e",
        "broad_protocol_endpoints:check:4275564e7b76",
        "broad_protocol_endpoints:check:48cf09af2d58",
        "broad_protocol_endpoints:check:4d16ecf90a94",
        "broad_protocol_endpoints:check:5690b441904b",
        "broad_protocol_endpoints:check:5bf609ff4b55",
        "broad_protocol_endpoints:check:5c2718024236",
        "broad_protocol_endpoints:check:7c29014cdfde",
        "broad_protocol_endpoints:check:89bbfbe9b43e",
        "broad_protocol_endpoints:check:92e5c8c4a819",
        "broad_protocol_endpoints:check:93b63328faea",
        "broad_protocol_endpoints:check:9ab7372f2622",
        "broad_protocol_endpoints:check:a6d89bdbb106",
        "broad_protocol_endpoints:check:b586e0702dff",
        "broad_protocol_endpoints:check:b5d14e09d9e2",
        "broad_protocol_endpoints:check:b8948de5ebf9",
        "broad_protocol_endpoints:check:c89d09bbd364",
        "broad_protocol_endpoints:check:db637a3de726",
        "broad_protocol_endpoints:check:e29b0e8f5028",
        "broad_protocol_endpoints:check:f63c10800a10",
        "broad_protocol_endpoints:check:fa031e94c5d0"
      ],
      "killed": true,
      "mutant_id": "avalon-mm-1.0-rule-4"
    }
  ],
  "non_vacuity": "passed",
  "profile_id": "avalon-mm-1.0",
  "profile_sha256": "7ddc8731e2ac9fad4aa32b68c42db4fb46f16622596525ff2f43dbcdc2ed6969",
  "profile_version": "1.0",
  "role": "agent",
  "schema_version": 1,
  "source_sha256": "9af979891122fdceef83b7518b2c0ce485085138f601509ab26308fce67218a7",
  "strict_status": "passed",
  "target": "formal",
  "tool_versions": {
    "sby": "0.67",
    "yosys": "0.33",
    "z3": "4.8.12"
  }
}
