{
  "commands": [
    "dv-platform analyze-rtl",
    "dv-platform plan --target vhdl",
    "dv-platform generate --target vhdl",
    "dv-platform run --target vhdl",
    "dv-platform coverage --from-runs",
    "dv-platform status --policy ci"
  ],
  "configuration_sha256": "0f1defbbbdb0e811b215f044584c9c9fd522a822f2e5f4233f8aff20b5175cae",
  "coverage": {
    "measured_ids": [
      "broad_protocol_endpoints_vhdl:check:0d464a65e380",
      "broad_protocol_endpoints_vhdl:check:14893cfa9eab",
      "broad_protocol_endpoints_vhdl:check:2294b1cefeb0",
      "broad_protocol_endpoints_vhdl:check:34fd66cbffde",
      "broad_protocol_endpoints_vhdl:check:35ef0f2bfc8d",
      "broad_protocol_endpoints_vhdl:check:36894317a473",
      "broad_protocol_endpoints_vhdl:check:506a7aa21953",
      "broad_protocol_endpoints_vhdl:check:54c19f4fa355",
      "broad_protocol_endpoints_vhdl:check:6b2aaf96c302",
      "broad_protocol_endpoints_vhdl:check:6fb21bf34a25",
      "broad_protocol_endpoints_vhdl:check:764765c9848a",
      "broad_protocol_endpoints_vhdl:check:9121882cdb9b",
      "broad_protocol_endpoints_vhdl:check:9a64d134514e",
      "broad_protocol_endpoints_vhdl:check:a1c14a70496c",
      "broad_protocol_endpoints_vhdl:check:a2ca27f35dbc",
      "broad_protocol_endpoints_vhdl:check:b2ac9a640538",
      "broad_protocol_endpoints_vhdl:check:cbcbd6398d05",
      "broad_protocol_endpoints_vhdl:check:d4bb0b4c5438",
      "broad_protocol_endpoints_vhdl:check:df868d014d63",
      "broad_protocol_endpoints_vhdl:check:e72ed0a94485",
      "broad_protocol_endpoints_vhdl:check:ef27c47a2d3a",
      "broad_protocol_endpoints_vhdl:check:fda13b8a09d8"
    ],
    "missing_ids": [],
    "schema_version": 3
  },
  "execution_kind": "real",
  "expected_checks": [
    "broad_protocol_endpoints_vhdl:check:0d464a65e380",
    "broad_protocol_endpoints_vhdl:check:14893cfa9eab",
    "broad_protocol_endpoints_vhdl:check:2294b1cefeb0",
    "broad_protocol_endpoints_vhdl:check:34fd66cbffde",
    "broad_protocol_endpoints_vhdl:check:35ef0f2bfc8d",
    "broad_protocol_endpoints_vhdl:check:36894317a473",
    "broad_protocol_endpoints_vhdl:check:506a7aa21953",
    "broad_protocol_endpoints_vhdl:check:54c19f4fa355",
    "broad_protocol_endpoints_vhdl:check:6b2aaf96c302",
    "broad_protocol_endpoints_vhdl:check:6fb21bf34a25",
    "broad_protocol_endpoints_vhdl:check:764765c9848a",
    "broad_protocol_endpoints_vhdl:check:9121882cdb9b",
    "broad_protocol_endpoints_vhdl:check:9a64d134514e",
    "broad_protocol_endpoints_vhdl:check:a1c14a70496c",
    "broad_protocol_endpoints_vhdl:check:a2ca27f35dbc",
    "broad_protocol_endpoints_vhdl:check:b2ac9a640538",
    "broad_protocol_endpoints_vhdl:check:cbcbd6398d05",
    "broad_protocol_endpoints_vhdl:check:d4bb0b4c5438",
    "broad_protocol_endpoints_vhdl:check:df868d014d63",
    "broad_protocol_endpoints_vhdl:check:e72ed0a94485",
    "broad_protocol_endpoints_vhdl:check:ef27c47a2d3a",
    "broad_protocol_endpoints_vhdl:check:fda13b8a09d8"
  ],
  "mutant_outcomes": [
    {
      "check_ids": [
        "broad_protocol_endpoints_vhdl:check:0d464a65e380",
        "broad_protocol_endpoints_vhdl:check:14893cfa9eab",
        "broad_protocol_endpoints_vhdl:check:2294b1cefeb0",
        "broad_protocol_endpoints_vhdl:check:34fd66cbffde",
        "broad_protocol_endpoints_vhdl:check:35ef0f2bfc8d",
        "broad_protocol_endpoints_vhdl:check:36894317a473",
        "broad_protocol_endpoints_vhdl:check:506a7aa21953",
        "broad_protocol_endpoints_vhdl:check:54c19f4fa355",
        "broad_protocol_endpoints_vhdl:check:6b2aaf96c302",
        "broad_protocol_endpoints_vhdl:check:6fb21bf34a25",
        "broad_protocol_endpoints_vhdl:check:764765c9848a",
        "broad_protocol_endpoints_vhdl:check:9121882cdb9b",
        "broad_protocol_endpoints_vhdl:check:9a64d134514e",
        "broad_protocol_endpoints_vhdl:check:a1c14a70496c",
        "broad_protocol_endpoints_vhdl:check:a2ca27f35dbc",
        "broad_protocol_endpoints_vhdl:check:b2ac9a640538",
        "broad_protocol_endpoints_vhdl:check:cbcbd6398d05",
        "broad_protocol_endpoints_vhdl:check:d4bb0b4c5438",
        "broad_protocol_endpoints_vhdl:check:df868d014d63",
        "broad_protocol_endpoints_vhdl:check:e72ed0a94485",
        "broad_protocol_endpoints_vhdl:check:ef27c47a2d3a",
        "broad_protocol_endpoints_vhdl:check:fda13b8a09d8"
      ],
      "killed": true,
      "mutant_id": "avalon-st-1.0-rule-5"
    }
  ],
  "non_vacuity": "passed",
  "profile_id": "avalon-st-1.0",
  "profile_sha256": "cde1954ee44e04d16278eb166abf4b8fda49ffd693ef559e22611366eb4e05d5",
  "profile_version": "1.0",
  "role": "sink",
  "schema_version": 1,
  "source_sha256": "dce916da296fc099ecf8ae332e6ac86df134cdde1467971286ed06067dba5c2a",
  "strict_status": "passed",
  "target": "vhdl",
  "tool_versions": {
    "ghdl": "4.1.0"
  }
}
