{
  "commands": [
    "dv-platform analyze-rtl",
    "dv-platform plan --target cocotb",
    "dv-platform generate --target cocotb",
    "dv-platform run --target cocotb",
    "dv-platform coverage --from-runs",
    "dv-platform status --policy ci"
  ],
  "configuration_sha256": "2a364d1bed22185db88dd8d370922f6e052745b7ccef49983938d5281cd93de2",
  "coverage": {
    "measured_ids": [
      "broad_protocol_endpoints:check:092ebe8f4985",
      "broad_protocol_endpoints:check:1f329a88a151",
      "broad_protocol_endpoints:check:2e7e3860fd81",
      "broad_protocol_endpoints:check:41ad9a9866fd",
      "broad_protocol_endpoints:check:41dde9ef374e",
      "broad_protocol_endpoints:check:4275564e7b76",
      "broad_protocol_endpoints:check:48cf09af2d58",
      "broad_protocol_endpoints:check:4d16ecf90a94",
      "broad_protocol_endpoints:check:5690b441904b",
      "broad_protocol_endpoints:check:5bf609ff4b55",
      "broad_protocol_endpoints:check:5c2718024236",
      "broad_protocol_endpoints:check:7c29014cdfde",
      "broad_protocol_endpoints:check:89bbfbe9b43e",
      "broad_protocol_endpoints:check:92e5c8c4a819",
      "broad_protocol_endpoints:check:93b63328faea",
      "broad_protocol_endpoints:check:9ab7372f2622",
      "broad_protocol_endpoints:check:a6d89bdbb106",
      "broad_protocol_endpoints:check:b586e0702dff",
      "broad_protocol_endpoints:check:b5d14e09d9e2",
      "broad_protocol_endpoints:check:b8948de5ebf9",
      "broad_protocol_endpoints:check:c89d09bbd364",
      "broad_protocol_endpoints:check:db637a3de726",
      "broad_protocol_endpoints:check:e29b0e8f5028",
      "broad_protocol_endpoints:check:f63c10800a10",
      "broad_protocol_endpoints:check:fa031e94c5d0"
    ],
    "missing_ids": [],
    "schema_version": 3
  },
  "execution_kind": "real",
  "expected_checks": [
    "broad_protocol_endpoints:check:092ebe8f4985",
    "broad_protocol_endpoints:check:1f329a88a151",
    "broad_protocol_endpoints:check:2e7e3860fd81",
    "broad_protocol_endpoints:check:41ad9a9866fd",
    "broad_protocol_endpoints:check:41dde9ef374e",
    "broad_protocol_endpoints:check:4275564e7b76",
    "broad_protocol_endpoints:check:48cf09af2d58",
    "broad_protocol_endpoints:check:4d16ecf90a94",
    "broad_protocol_endpoints:check:5690b441904b",
    "broad_protocol_endpoints:check:5bf609ff4b55",
    "broad_protocol_endpoints:check:5c2718024236",
    "broad_protocol_endpoints:check:7c29014cdfde",
    "broad_protocol_endpoints:check:89bbfbe9b43e",
    "broad_protocol_endpoints:check:92e5c8c4a819",
    "broad_protocol_endpoints:check:93b63328faea",
    "broad_protocol_endpoints:check:9ab7372f2622",
    "broad_protocol_endpoints:check:a6d89bdbb106",
    "broad_protocol_endpoints:check:b586e0702dff",
    "broad_protocol_endpoints:check:b5d14e09d9e2",
    "broad_protocol_endpoints:check:b8948de5ebf9",
    "broad_protocol_endpoints:check:c89d09bbd364",
    "broad_protocol_endpoints:check:db637a3de726",
    "broad_protocol_endpoints:check:e29b0e8f5028",
    "broad_protocol_endpoints:check:f63c10800a10",
    "broad_protocol_endpoints:check:fa031e94c5d0"
  ],
  "mutant_outcomes": [
    {
      "check_ids": [
        "broad_protocol_endpoints:check:092ebe8f4985",
        "broad_protocol_endpoints:check:1f329a88a151",
        "broad_protocol_endpoints:check:2e7e3860fd81",
        "broad_protocol_endpoints:check:41ad9a9866fd",
        "broad_protocol_endpoints:check:41dde9ef374e",
        "broad_protocol_endpoints:check:4275564e7b76",
        "broad_protocol_endpoints:check:48cf09af2d58",
        "broad_protocol_endpoints:check:4d16ecf90a94",
        "broad_protocol_endpoints:check:5690b441904b",
        "broad_protocol_endpoints:check:5bf609ff4b55",
        "broad_protocol_endpoints:check:5c2718024236",
        "broad_protocol_endpoints:check:7c29014cdfde",
        "broad_protocol_endpoints:check:89bbfbe9b43e",
        "broad_protocol_endpoints:check:92e5c8c4a819",
        "broad_protocol_endpoints:check:93b63328faea",
        "broad_protocol_endpoints:check:9ab7372f2622",
        "broad_protocol_endpoints:check:a6d89bdbb106",
        "broad_protocol_endpoints:check:b586e0702dff",
        "broad_protocol_endpoints:check:b5d14e09d9e2",
        "broad_protocol_endpoints:check:b8948de5ebf9",
        "broad_protocol_endpoints:check:c89d09bbd364",
        "broad_protocol_endpoints:check:db637a3de726",
        "broad_protocol_endpoints:check:e29b0e8f5028",
        "broad_protocol_endpoints:check:f63c10800a10",
        "broad_protocol_endpoints:check:fa031e94c5d0"
      ],
      "killed": true,
      "mutant_id": "axi4-1.0-rule-1"
    },
    {
      "check_ids": [
        "broad_protocol_endpoints:check:092ebe8f4985",
        "broad_protocol_endpoints:check:1f329a88a151",
        "broad_protocol_endpoints:check:2e7e3860fd81",
        "broad_protocol_endpoints:check:41ad9a9866fd",
        "broad_protocol_endpoints:check:41dde9ef374e",
        "broad_protocol_endpoints:check:4275564e7b76",
        "broad_protocol_endpoints:check:48cf09af2d58",
        "broad_protocol_endpoints:check:4d16ecf90a94",
        "broad_protocol_endpoints:check:5690b441904b",
        "broad_protocol_endpoints:check:5bf609ff4b55",
        "broad_protocol_endpoints:check:5c2718024236",
        "broad_protocol_endpoints:check:7c29014cdfde",
        "broad_protocol_endpoints:check:89bbfbe9b43e",
        "broad_protocol_endpoints:check:92e5c8c4a819",
        "broad_protocol_endpoints:check:93b63328faea",
        "broad_protocol_endpoints:check:9ab7372f2622",
        "broad_protocol_endpoints:check:a6d89bdbb106",
        "broad_protocol_endpoints:check:b586e0702dff",
        "broad_protocol_endpoints:check:b5d14e09d9e2",
        "broad_protocol_endpoints:check:b8948de5ebf9",
        "broad_protocol_endpoints:check:c89d09bbd364",
        "broad_protocol_endpoints:check:db637a3de726",
        "broad_protocol_endpoints:check:e29b0e8f5028",
        "broad_protocol_endpoints:check:f63c10800a10",
        "broad_protocol_endpoints:check:fa031e94c5d0"
      ],
      "killed": true,
      "mutant_id": "axi4-1.0-rule-2"
    }
  ],
  "non_vacuity": "passed",
  "profile_id": "axi4-1.0",
  "profile_sha256": "8575bd9f8d41a2781b2ccd48e12dcc15ddff8e4dcd98e7b462bf070b3ca43da3",
  "profile_version": "1.0",
  "role": "subordinate",
  "schema_version": 1,
  "source_sha256": "9af979891122fdceef83b7518b2c0ce485085138f601509ab26308fce67218a7",
  "strict_status": "passed",
  "target": "cocotb",
  "tool_versions": {
    "iverilog": "12.0",
    "verilator": "5.020"
  }
}
