{
  "commands": [
    "dv-platform analyze-rtl",
    "dv-platform plan --target cocotb",
    "dv-platform generate --target cocotb",
    "dv-platform run --target cocotb --module axi4_stream_profile_source",
    "dv-platform coverage --from-runs",
    "dv-platform status --policy ci"
  ],
  "configuration_sha256": "30a13f94ef01fe01fdbdaeb619ebd31221b3c85874ae0d9097575e427e0e8d31",
  "coverage": {
    "measured_ids": [
      "axi4_stream_profile_source:check:5add682eb3aa",
      "axi4_stream_profile_source:check:da86a565fddc",
      "axi4_stream_profile_source:check:e32fc0c23873"
    ],
    "missing_ids": [],
    "schema_version": 3
  },
  "execution_kind": "real",
  "expected_checks": [
    "axi4_stream_profile_source:check:5add682eb3aa",
    "axi4_stream_profile_source:check:da86a565fddc",
    "axi4_stream_profile_source:check:e32fc0c23873"
  ],
  "mutant_outcomes": [
    {
      "check_ids": [
        "axi4_stream_profile_source:check:5add682eb3aa",
        "axi4_stream_profile_source:check:da86a565fddc",
        "axi4_stream_profile_source:check:e32fc0c23873"
      ],
      "killed": true,
      "mutant_id": "packet-rule-1"
    },
    {
      "check_ids": [
        "axi4_stream_profile_source:check:5add682eb3aa",
        "axi4_stream_profile_source:check:da86a565fddc",
        "axi4_stream_profile_source:check:e32fc0c23873"
      ],
      "killed": true,
      "mutant_id": "packet-rule-2"
    },
    {
      "check_ids": [
        "axi4_stream_profile_source:check:5add682eb3aa",
        "axi4_stream_profile_source:check:b3a028f4dd7f",
        "axi4_stream_profile_source:check:da86a565fddc",
        "axi4_stream_profile_source:check:e32fc0c23873"
      ],
      "killed": true,
      "mutant_id": "packet-rule-3"
    },
    {
      "check_ids": [
        "axi4_stream_profile_source:check:4970109930c9",
        "axi4_stream_profile_source:check:5add682eb3aa",
        "axi4_stream_profile_source:check:da86a565fddc",
        "axi4_stream_profile_source:check:e32fc0c23873"
      ],
      "killed": true,
      "mutant_id": "packet-rule-4"
    }
  ],
  "non_vacuity": "passed",
  "profile_id": "axi4-stream-1.0",
  "profile_sha256": "a8b79b8ab7e4bda1296bedcbc35a9423eaa5da323d695daa044ea61275ad5e38",
  "profile_version": "1.0",
  "role": "source",
  "schema_version": 1,
  "source_sha256": "5b737aa431c9ca6a3e2818b4d3b24c0da951d5526dbd40c37643b0692f07c566",
  "strict_status": "passed",
  "target": "cocotb",
  "tool_versions": {
    "iverilog": "12.0",
    "verilator": "5.020"
  }
}
