{
  "commands": [
    "dv-platform analyze-rtl",
    "dv-platform plan --target cocotb",
    "dv-platform generate --target cocotb",
    "dv-platform run --target cocotb",
    "dv-platform coverage --from-runs",
    "dv-platform status --policy ci"
  ],
  "configuration_sha256": "8ba7eb20ccd46f445e85f46967bc7e5aef0657e0973d7282aed8afe28d290366",
  "coverage": {
    "measured_ids": [
      "memory_bounded_qualified:check:0bd74b9a7961",
      "memory_bounded_qualified:check:1be39f45b3ab",
      "memory_bounded_qualified:check:27bffeffe502",
      "memory_bounded_qualified:check:3c8d6abfa74d",
      "memory_bounded_qualified:check:41c54cb2a2ed",
      "memory_bounded_qualified:check:4463b3640935",
      "memory_bounded_qualified:check:4a53bd5b2be3",
      "memory_bounded_qualified:check:6a9b235d2deb",
      "memory_bounded_qualified:check:6f1a895cb63b",
      "memory_bounded_qualified:check:7f76f5106105",
      "memory_bounded_qualified:check:85b1253cf69a",
      "memory_bounded_qualified:check:943b061f7994",
      "memory_bounded_qualified:check:987dada437fd",
      "memory_bounded_qualified:check:bb1485eb3a1f",
      "memory_bounded_qualified:check:bb4d77321c4a"
    ],
    "missing_ids": [],
    "schema_version": 3
  },
  "execution_kind": "real",
  "expected_checks": [
    "memory_bounded_qualified:check:0bd74b9a7961",
    "memory_bounded_qualified:check:1be39f45b3ab",
    "memory_bounded_qualified:check:27bffeffe502",
    "memory_bounded_qualified:check:3c8d6abfa74d",
    "memory_bounded_qualified:check:41c54cb2a2ed",
    "memory_bounded_qualified:check:4463b3640935",
    "memory_bounded_qualified:check:4a53bd5b2be3",
    "memory_bounded_qualified:check:6a9b235d2deb",
    "memory_bounded_qualified:check:6f1a895cb63b",
    "memory_bounded_qualified:check:7f76f5106105",
    "memory_bounded_qualified:check:85b1253cf69a",
    "memory_bounded_qualified:check:943b061f7994",
    "memory_bounded_qualified:check:987dada437fd",
    "memory_bounded_qualified:check:bb1485eb3a1f",
    "memory_bounded_qualified:check:bb4d77321c4a"
  ],
  "mutant_outcomes": [
    {
      "check_ids": [
        "memory_bounded_qualified:check:1be39f45b3ab",
        "memory_bounded_qualified:check:41c54cb2a2ed",
        "memory_bounded_qualified:check:6a9b235d2deb",
        "memory_bounded_qualified:check:6f1a895cb63b",
        "memory_bounded_qualified:check:7f76f5106105",
        "memory_bounded_qualified:check:bb1485eb3a1f",
        "memory_bounded_qualified:check:bb4d77321c4a"
      ],
      "killed": true,
      "mutant_id": "bounded-sram-init-hex-1.0-rule-1"
    },
    {
      "check_ids": [
        "memory_bounded_qualified:check:1be39f45b3ab",
        "memory_bounded_qualified:check:41c54cb2a2ed",
        "memory_bounded_qualified:check:6a9b235d2deb",
        "memory_bounded_qualified:check:6f1a895cb63b",
        "memory_bounded_qualified:check:7f76f5106105",
        "memory_bounded_qualified:check:bb1485eb3a1f",
        "memory_bounded_qualified:check:bb4d77321c4a"
      ],
      "killed": true,
      "mutant_id": "bounded-sram-init-hex-1.0-rule-2"
    },
    {
      "check_ids": [
        "memory_bounded_qualified:check:1be39f45b3ab",
        "memory_bounded_qualified:check:41c54cb2a2ed",
        "memory_bounded_qualified:check:6a9b235d2deb",
        "memory_bounded_qualified:check:6f1a895cb63b",
        "memory_bounded_qualified:check:7f76f5106105",
        "memory_bounded_qualified:check:bb1485eb3a1f",
        "memory_bounded_qualified:check:bb4d77321c4a"
      ],
      "killed": true,
      "mutant_id": "bounded-sram-init-hex-1.0-rule-3"
    },
    {
      "check_ids": [
        "memory_bounded_qualified:check:1be39f45b3ab",
        "memory_bounded_qualified:check:41c54cb2a2ed",
        "memory_bounded_qualified:check:6a9b235d2deb",
        "memory_bounded_qualified:check:6f1a895cb63b",
        "memory_bounded_qualified:check:7f76f5106105",
        "memory_bounded_qualified:check:bb1485eb3a1f",
        "memory_bounded_qualified:check:bb4d77321c4a"
      ],
      "killed": true,
      "mutant_id": "bounded-sram-init-hex-1.0-rule-4"
    },
    {
      "check_ids": [
        "memory_bounded_qualified:check:1be39f45b3ab",
        "memory_bounded_qualified:check:41c54cb2a2ed",
        "memory_bounded_qualified:check:6a9b235d2deb",
        "memory_bounded_qualified:check:6f1a895cb63b",
        "memory_bounded_qualified:check:bb1485eb3a1f",
        "memory_bounded_qualified:check:bb4d77321c4a"
      ],
      "killed": true,
      "mutant_id": "bounded-sram-init-hex-1.0-rule-5"
    },
    {
      "check_ids": [
        "memory_bounded_qualified:check:1be39f45b3ab",
        "memory_bounded_qualified:check:41c54cb2a2ed",
        "memory_bounded_qualified:check:6a9b235d2deb",
        "memory_bounded_qualified:check:6f1a895cb63b",
        "memory_bounded_qualified:check:7f76f5106105",
        "memory_bounded_qualified:check:bb1485eb3a1f",
        "memory_bounded_qualified:check:bb4d77321c4a"
      ],
      "killed": true,
      "mutant_id": "bounded-sram-init-hex-1.0-rule-6"
    },
    {
      "check_ids": [
        "memory_bounded_qualified:check:1be39f45b3ab",
        "memory_bounded_qualified:check:41c54cb2a2ed",
        "memory_bounded_qualified:check:6a9b235d2deb",
        "memory_bounded_qualified:check:6f1a895cb63b",
        "memory_bounded_qualified:check:7f76f5106105",
        "memory_bounded_qualified:check:bb1485eb3a1f",
        "memory_bounded_qualified:check:bb4d77321c4a"
      ],
      "killed": true,
      "mutant_id": "bounded-sram-init-hex-1.0-rule-7"
    },
    {
      "check_ids": [
        "memory_bounded_qualified:check:1be39f45b3ab",
        "memory_bounded_qualified:check:41c54cb2a2ed",
        "memory_bounded_qualified:check:6a9b235d2deb",
        "memory_bounded_qualified:check:6f1a895cb63b",
        "memory_bounded_qualified:check:7f76f5106105",
        "memory_bounded_qualified:check:bb1485eb3a1f",
        "memory_bounded_qualified:check:bb4d77321c4a"
      ],
      "killed": true,
      "mutant_id": "bounded-sram-init-hex-1.0-rule-8"
    }
  ],
  "non_vacuity": "passed",
  "profile_id": "bounded-sram-init-hex-1.0",
  "profile_sha256": "d4efe54e7a0e577d32babb519e8cc95a930e7df04270ab69948316b4d4028eb0",
  "profile_version": "1.0",
  "role": "memory",
  "schema_version": 1,
  "source_sha256": "aed021d1737013fa589fa962bcd6c5eee2117713aec78d5e09c13d98f11e0254",
  "strict_status": "passed",
  "target": "cocotb",
  "tool_versions": {
    "iverilog": "Icarus Verilog version 12.0 (stable) ()",
    "verilator": "Verilator 5.020 2024-01-01 rev (Debian 5.020-1)"
  }
}
